{
  "$schema": "http://json-schema.org/schema#",
  "type": "object",
  "properties": {
    "id": {
      "type": "integer"
    },
    "name": {
      "type": "string"
    },
    "order": {
      "type": "integer"
    },
    "gender_rate": {
      "type": "integer"
    },
    "capture_rate": {
      "type": "integer"
    },
    "base_happiness": {
      "type": "integer"
    },
    "is_baby": {
      "type": "boolean"
    },
    "is_legendary": {
      "type": "boolean"
    },
    "is_mythical": {
      "type": "boolean"
    },
    "hatch_counter": {
      "type": "integer"
    },
    "has_gender_differences": {
      "type": "boolean"
    },
    "forms_switchable": {
      "type": "boolean"
    },
    "growth_rate": {
      "$ref": "/schema/v2/named_api_resource.json"
    },
    "pokedex_numbers": {
      "type": "array",
      "items": {
        "type": "object",
        "properties": {
          "entry_number": {
            "type": "integer"
          },
          "pokedex": {
            "$ref": "/schema/v2/named_api_resource.json"
          }
        },
        "required": [
          "entry_number",
          "pokedex"
        ]
      }
    },
    "egg_groups": {
      "type": "array",
      "items": {
        "$ref": "/schema/v2/named_api_resource.json"
      }
    },
    "color": {
      "$ref": "/schema/v2/named_api_resource.json"
    },
    "shape": {
      "$ref": "/schema/v2/named_api_resource.json"
    },
    "evolves_from_species": {
      "anyOf": [
        {
          "type": "null"
        },
        {
          "$ref": "/schema/v2/named_api_resource.json"
        }
      ]
    },
    "evolution_chain": {
      "$ref": "/schema/v2/api_resource.json"
    },
    "habitat": {
      "anyOf": [
        {
          "type": "null"
        },
        {
          "$ref": "/schema/v2/named_api_resource.json"
        }
      ]
    },
    "generation": {
      "$ref": "/schema/v2/named_api_resource.json"
    },
    "names": {
      "type": "array",
      "items": {
        "$ref": "/schema/v2/name.json"
      }
    },
    "pal_park_encounters": {
      "type": "array",
      "items": {
        "type": "object",
        "properties": {
          "base_score": {
            "type": "integer"
          },
          "rate": {
            "type": "integer"
          },
          "area": {
            "$ref": "/schema/v2/named_api_resource.json"
          }
        },
        "required": [
          "area",
          "base_score",
          "rate"
        ]
      }
    },
    "form_descriptions": {
      "type": "array",
      "items": {
        "$ref": "/schema/v2/description.json"
      }
    },
    "flavor_text_entries": {
      "type": "array",
      "items": {
        "type": "object",
        "properties": {
          "flavor_text": {
            "type": "string"
          },
          "language": {
            "$ref": "/schema/v2/named_api_resource.json"
          },
          "version": {
            "$ref": "/schema/v2/named_api_resource.json"
          }
        },
        "required": [
          "flavor_text",
          "language",
          "version"
        ]
      }
    },
    "genera": {
      "type": "array",
      "items": {
        "type": "object",
        "properties": {
          "genus": {
            "type": "string"
          },
          "language": {
            "$ref": "/schema/v2/named_api_resource.json"
          }
        },
        "required": [
          "genus",
          "language"
        ]
      }
    },
    "varieties": {
      "type": "array",
      "items": {
        "type": "object",
        "properties": {
          "is_default": {
            "type": "boolean"
          },
          "pokemon": {
            "$ref": "/schema/v2/named_api_resource.json"
          }
        },
        "required": [
          "is_default",
          "pokemon"
        ]
      }
    }
  },
  "required": [
    "base_happiness",
    "capture_rate",
    "color",
    "egg_groups",
    "evolution_chain",
    "evolves_from_species",
    "flavor_text_entries",
    "form_descriptions",
    "forms_switchable",
    "gender_rate",
    "genera",
    "generation",
    "growth_rate",
    "habitat",
    "has_gender_differences",
    "hatch_counter",
    "id",
    "is_baby",
    "is_legendary",
    "is_mythical",
    "name",
    "names",
    "order",
    "pal_park_encounters",
    "pokedex_numbers",
    "shape",
    "varieties"
  ]
}