{
  "id": 1020,
  "name": "gouging-fire",
  "order": 1022,
  "gender_rate": -1,
  "capture_rate": 10,
  "base_happiness": 0,
  "is_baby": false,
  "is_legendary": false,
  "is_mythical": false,
  "hatch_counter": 50,
  "has_gender_differences": false,
  "forms_switchable": false,
  "growth_rate": {
    "name": "slow",
    "url": "/api/v2/growth-rate/1/"
  },
  "pokedex_numbers": [
    {
      "entry_number": 1020,
      "pokedex": {
        "name": "national",
        "url": "/api/v2/pokedex/1/"
      }
    },
    {
      "entry_number": 236,
      "pokedex": {
        "name": "blueberry",
        "url": "/api/v2/pokedex/33/"
      }
    }
  ],
  "egg_groups": [
    {
      "name": "no-eggs",
      "url": "/api/v2/egg-group/15/"
    }
  ],
  "color": {
    "name": "brown",
    "url": "/api/v2/pokemon-color/3/"
  },
  "shape": {
    "name": "quadruped",
    "url": "/api/v2/pokemon-shape/8/"
  },
  "evolves_from_species": null,
  "evolution_chain": {
    "url": "/api/v2/evolution-chain/544/"
  },
  "habitat": null,
  "generation": {
    "name": "generation-ix",
    "url": "/api/v2/generation/9/"
  },
  "names": [
    {
      "name": "ウガツホムラ",
      "language": {
        "name": "ja-hrkt",
        "url": "/api/v2/language/1/"
      }
    },
    {
      "name": "Ugatsuhomura",
      "language": {
        "name": "ja-roma",
        "url": "/api/v2/language/2/"
      }
    },
    {
      "name": "꿰뚫는화염",
      "language": {
        "name": "ko",
        "url": "/api/v2/language/3/"
      }
    },
    {
      "name": "破空焰",
      "language": {
        "name": "zh-hant",
        "url": "/api/v2/language/4/"
      }
    },
    {
      "name": "Feu-Perçant",
      "language": {
        "name": "fr",
        "url": "/api/v2/language/5/"
      }
    },
    {
      "name": "Keilflamme",
      "language": {
        "name": "de",
        "url": "/api/v2/language/6/"
      }
    },
    {
      "name": "Flamariete",
      "language": {
        "name": "es",
        "url": "/api/v2/language/7/"
      }
    },
    {
      "name": "Vampeaguzze",
      "language": {
        "name": "it",
        "url": "/api/v2/language/8/"
      }
    },
    {
      "name": "Gouging Fire",
      "language": {
        "name": "en",
        "url": "/api/v2/language/9/"
      }
    },
    {
      "name": "ウガツホムラ",
      "language": {
        "name": "ja",
        "url": "/api/v2/language/11/"
      }
    },
    {
      "name": "破空焰",
      "language": {
        "name": "zh-hans",
        "url": "/api/v2/language/12/"
      }
    },
    {
      "name": "Flamariete",
      "language": {
        "name": "es-419",
        "url": "/api/v2/language/14/"
      }
    }
  ],
  "pal_park_encounters": [],
  "form_descriptions": [],
  "flavor_text_entries": [
    {
      "flavor_text": "There are scant few reports of this creature being sighted. One short video shows it rampaging and spouting pillars of flame.",
      "language": {
        "name": "en",
        "url": "/api/v2/language/9/"
      },
      "version": {
        "name": "scarlet",
        "url": "/api/v2/version/40/"
      }
    },
    {
      "flavor_text": "It resembles an eerie Pokémon once shown in a paranormal magazine. That Pokémon was said to be an Entei regenerated from a fossil.",
      "language": {
        "name": "en",
        "url": "/api/v2/language/9/"
      },
      "version": {
        "name": "violet",
        "url": "/api/v2/version/41/"
      }
    }
  ],
  "genera": [
    {
      "genus": "パラドックスポケモン",
      "language": {
        "name": "ja-hrkt",
        "url": "/api/v2/language/1/"
      }
    },
    {
      "genus": "패러독스포켓몬",
      "language": {
        "name": "ko",
        "url": "/api/v2/language/3/"
      }
    },
    {
      "genus": "Paradoxe",
      "language": {
        "name": "fr",
        "url": "/api/v2/language/5/"
      }
    },
    {
      "genus": "Paradox Pokémon",
      "language": {
        "name": "en",
        "url": "/api/v2/language/9/"
      }
    },
    {
      "genus": "パラドックスポケモン",
      "language": {
        "name": "ja",
        "url": "/api/v2/language/11/"
      }
    }
  ],
  "varieties": [
    {
      "is_default": true,
      "pokemon": {
        "name": "gouging-fire",
        "url": "/api/v2/pokemon/1020/"
      }
    }
  ]
}