{
  "id": 1025,
  "name": "pecharunt",
  "order": 1027,
  "gender_rate": -1,
  "capture_rate": 3,
  "base_happiness": 0,
  "is_baby": false,
  "is_legendary": false,
  "is_mythical": true,
  "hatch_counter": 20,
  "has_gender_differences": false,
  "forms_switchable": false,
  "growth_rate": {
    "name": "slow",
    "url": "/api/v2/growth-rate/1/"
  },
  "pokedex_numbers": [
    {
      "entry_number": 1025,
      "pokedex": {
        "name": "national",
        "url": "/api/v2/pokedex/1/"
      }
    },
    {
      "entry_number": 243,
      "pokedex": {
        "name": "blueberry",
        "url": "/api/v2/pokedex/33/"
      }
    }
  ],
  "egg_groups": [
    {
      "name": "no-eggs",
      "url": "/api/v2/egg-group/15/"
    }
  ],
  "color": {
    "name": "purple",
    "url": "/api/v2/pokemon-color/7/"
  },
  "shape": {
    "name": "ball",
    "url": "/api/v2/pokemon-shape/1/"
  },
  "evolves_from_species": null,
  "evolution_chain": {
    "url": "/api/v2/evolution-chain/549/"
  },
  "habitat": null,
  "generation": {
    "name": "generation-ix",
    "url": "/api/v2/generation/9/"
  },
  "names": [
    {
      "name": "モモワロウ",
      "language": {
        "name": "ja-hrkt",
        "url": "/api/v2/language/1/"
      }
    },
    {
      "name": "Momowarou",
      "language": {
        "name": "ja-roma",
        "url": "/api/v2/language/2/"
      }
    },
    {
      "name": "복숭악동",
      "language": {
        "name": "ko",
        "url": "/api/v2/language/3/"
      }
    },
    {
      "name": "桃歹郎",
      "language": {
        "name": "zh-hant",
        "url": "/api/v2/language/4/"
      }
    },
    {
      "name": "Pêchaminus",
      "language": {
        "name": "fr",
        "url": "/api/v2/language/5/"
      }
    },
    {
      "name": "Infamomo",
      "language": {
        "name": "de",
        "url": "/api/v2/language/6/"
      }
    },
    {
      "name": "Pecharunt",
      "language": {
        "name": "es",
        "url": "/api/v2/language/7/"
      }
    },
    {
      "name": "Pecharunt",
      "language": {
        "name": "it",
        "url": "/api/v2/language/8/"
      }
    },
    {
      "name": "Pecharunt",
      "language": {
        "name": "en",
        "url": "/api/v2/language/9/"
      }
    },
    {
      "name": "モモワロウ",
      "language": {
        "name": "ja",
        "url": "/api/v2/language/11/"
      }
    },
    {
      "name": "桃歹郎",
      "language": {
        "name": "zh-hans",
        "url": "/api/v2/language/12/"
      }
    },
    {
      "name": "Pecharunt",
      "language": {
        "name": "es-419",
        "url": "/api/v2/language/14/"
      }
    }
  ],
  "pal_park_encounters": [],
  "form_descriptions": [],
  "flavor_text_entries": [
    {
      "flavor_text": "It feeds others toxic mochi that draw out desires and capabilities. Those who eat the mochi fall under Pecharunt’s control, chained to its will.",
      "language": {
        "name": "en",
        "url": "/api/v2/language/9/"
      },
      "version": {
        "name": "scarlet",
        "url": "/api/v2/version/40/"
      }
    },
    {
      "flavor_text": "Its peach-shaped shell serves as storage for a potent poison. It makes poisonous mochi and serves them to people and Pokémon.",
      "language": {
        "name": "en",
        "url": "/api/v2/language/9/"
      },
      "version": {
        "name": "violet",
        "url": "/api/v2/version/41/"
      }
    }
  ],
  "genera": [
    {
      "genus": "しはいポケモン",
      "language": {
        "name": "ja-hrkt",
        "url": "/api/v2/language/1/"
      }
    },
    {
      "genus": "지배포켓몬",
      "language": {
        "name": "ko",
        "url": "/api/v2/language/3/"
      }
    },
    {
      "genus": "Emprise",
      "language": {
        "name": "fr",
        "url": "/api/v2/language/5/"
      }
    },
    {
      "genus": "Subjugation Pokémon",
      "language": {
        "name": "en",
        "url": "/api/v2/language/9/"
      }
    },
    {
      "genus": "しはいポケモン",
      "language": {
        "name": "ja",
        "url": "/api/v2/language/11/"
      }
    }
  ],
  "varieties": [
    {
      "is_default": true,
      "pokemon": {
        "name": "pecharunt",
        "url": "/api/v2/pokemon/1025/"
      }
    }
  ]
}