{
  "id": 971,
  "name": "greavard",
  "order": 924,
  "gender_rate": 4,
  "capture_rate": 120,
  "base_happiness": 50,
  "is_baby": false,
  "is_legendary": false,
  "is_mythical": false,
  "hatch_counter": 20,
  "has_gender_differences": false,
  "forms_switchable": false,
  "growth_rate": {
    "name": "medium-slow",
    "url": "/api/v2/growth-rate/4/"
  },
  "pokedex_numbers": [
    {
      "entry_number": 971,
      "pokedex": {
        "name": "national",
        "url": "/api/v2/pokedex/1/"
      }
    },
    {
      "entry_number": 311,
      "pokedex": {
        "name": "paldea",
        "url": "/api/v2/pokedex/31/"
      }
    },
    {
      "entry_number": 23,
      "pokedex": {
        "name": "hyperspace",
        "url": "/api/v2/pokedex/35/"
      }
    }
  ],
  "egg_groups": [
    {
      "name": "ground",
      "url": "/api/v2/egg-group/5/"
    }
  ],
  "color": {
    "name": "white",
    "url": "/api/v2/pokemon-color/9/"
  },
  "shape": {
    "name": "quadruped",
    "url": "/api/v2/pokemon-shape/8/"
  },
  "evolves_from_species": null,
  "evolution_chain": {
    "url": "/api/v2/evolution-chain/509/"
  },
  "habitat": null,
  "generation": {
    "name": "generation-ix",
    "url": "/api/v2/generation/9/"
  },
  "names": [
    {
      "name": "ボチ",
      "language": {
        "name": "ja-hrkt",
        "url": "/api/v2/language/1/"
      }
    },
    {
      "name": "Bochi",
      "language": {
        "name": "ja-roma",
        "url": "/api/v2/language/2/"
      }
    },
    {
      "name": "망망이",
      "language": {
        "name": "ko",
        "url": "/api/v2/language/3/"
      }
    },
    {
      "name": "墓仔狗",
      "language": {
        "name": "zh-hant",
        "url": "/api/v2/language/4/"
      }
    },
    {
      "name": "Toutombe",
      "language": {
        "name": "fr",
        "url": "/api/v2/language/5/"
      }
    },
    {
      "name": "Gruff",
      "language": {
        "name": "de",
        "url": "/api/v2/language/6/"
      }
    },
    {
      "name": "Greavard",
      "language": {
        "name": "es",
        "url": "/api/v2/language/7/"
      }
    },
    {
      "name": "Greavard",
      "language": {
        "name": "it",
        "url": "/api/v2/language/8/"
      }
    },
    {
      "name": "Greavard",
      "language": {
        "name": "en",
        "url": "/api/v2/language/9/"
      }
    },
    {
      "name": "ボチ",
      "language": {
        "name": "ja",
        "url": "/api/v2/language/11/"
      }
    },
    {
      "name": "墓仔狗",
      "language": {
        "name": "zh-hans",
        "url": "/api/v2/language/12/"
      }
    },
    {
      "name": "Greavard",
      "language": {
        "name": "es-419",
        "url": "/api/v2/language/14/"
      }
    }
  ],
  "pal_park_encounters": [],
  "form_descriptions": [],
  "flavor_text_entries": [
    {
      "flavor_text": "It is said that a dog Pokémon that died in the wild without ever interacting with a human was reborn as this Pokémon.",
      "language": {
        "name": "en",
        "url": "/api/v2/language/9/"
      },
      "version": {
        "name": "scarlet",
        "url": "/api/v2/version/40/"
      }
    },
    {
      "flavor_text": "This friendly Pokémon doesn’t like being alone. Pay it even the slightest bit of attention, and it will follow you forever.",
      "language": {
        "name": "en",
        "url": "/api/v2/language/9/"
      },
      "version": {
        "name": "violet",
        "url": "/api/v2/version/41/"
      }
    }
  ],
  "genera": [
    {
      "genus": "おばけいぬポケモン",
      "language": {
        "name": "ja-hrkt",
        "url": "/api/v2/language/1/"
      }
    },
    {
      "genus": "유령개포켓몬",
      "language": {
        "name": "ko",
        "url": "/api/v2/language/3/"
      }
    },
    {
      "genus": "鬼犬寶可夢",
      "language": {
        "name": "zh-hant",
        "url": "/api/v2/language/4/"
      }
    },
    {
      "genus": "Fantôchien",
      "language": {
        "name": "fr",
        "url": "/api/v2/language/5/"
      }
    },
    {
      "genus": "Geisterhund",
      "language": {
        "name": "de",
        "url": "/api/v2/language/6/"
      }
    },
    {
      "genus": "Ghost Dog Pokémon",
      "language": {
        "name": "en",
        "url": "/api/v2/language/9/"
      }
    },
    {
      "genus": "鬼犬宝可梦",
      "language": {
        "name": "zh-hans",
        "url": "/api/v2/language/12/"
      }
    }
  ],
  "varieties": [
    {
      "is_default": true,
      "pokemon": {
        "name": "greavard",
        "url": "/api/v2/pokemon/971/"
      }
    }
  ]
}