{
  "id": 1024,
  "name": "terapagos",
  "order": 1026,
  "gender_rate": 4,
  "capture_rate": 255,
  "base_happiness": 50,
  "is_baby": false,
  "is_legendary": true,
  "is_mythical": false,
  "hatch_counter": 5,
  "has_gender_differences": false,
  "forms_switchable": false,
  "growth_rate": {
    "name": "slow",
    "url": "/api/v2/growth-rate/1/"
  },
  "pokedex_numbers": [
    {
      "entry_number": 1024,
      "pokedex": {
        "name": "national",
        "url": "/api/v2/pokedex/1/"
      }
    },
    {
      "entry_number": 240,
      "pokedex": {
        "name": "blueberry",
        "url": "/api/v2/pokedex/33/"
      }
    }
  ],
  "egg_groups": [
    {
      "name": "no-eggs",
      "url": "/api/v2/egg-group/15/"
    }
  ],
  "color": {
    "name": "blue",
    "url": "/api/v2/pokemon-color/2/"
  },
  "shape": {
    "name": "quadruped",
    "url": "/api/v2/pokemon-shape/8/"
  },
  "evolves_from_species": null,
  "evolution_chain": {
    "url": "/api/v2/evolution-chain/548/"
  },
  "habitat": null,
  "generation": {
    "name": "generation-ix",
    "url": "/api/v2/generation/9/"
  },
  "names": [
    {
      "name": "テラパゴス",
      "language": {
        "name": "ja-hrkt",
        "url": "/api/v2/language/1/"
      }
    },
    {
      "name": "Terapagos",
      "language": {
        "name": "ja-roma",
        "url": "/api/v2/language/2/"
      }
    },
    {
      "name": "테라파고스",
      "language": {
        "name": "ko",
        "url": "/api/v2/language/3/"
      }
    },
    {
      "name": "太樂巴戈斯",
      "language": {
        "name": "zh-hant",
        "url": "/api/v2/language/4/"
      }
    },
    {
      "name": "Terapagos",
      "language": {
        "name": "fr",
        "url": "/api/v2/language/5/"
      }
    },
    {
      "name": "Terapagos",
      "language": {
        "name": "de",
        "url": "/api/v2/language/6/"
      }
    },
    {
      "name": "Terapagos",
      "language": {
        "name": "es",
        "url": "/api/v2/language/7/"
      }
    },
    {
      "name": "Terapagos",
      "language": {
        "name": "it",
        "url": "/api/v2/language/8/"
      }
    },
    {
      "name": "Terapagos",
      "language": {
        "name": "en",
        "url": "/api/v2/language/9/"
      }
    },
    {
      "name": "テラパゴス",
      "language": {
        "name": "ja",
        "url": "/api/v2/language/11/"
      }
    },
    {
      "name": "太乐巴戈斯",
      "language": {
        "name": "zh-hans",
        "url": "/api/v2/language/12/"
      }
    },
    {
      "name": "Terapagos",
      "language": {
        "name": "es-419",
        "url": "/api/v2/language/14/"
      }
    }
  ],
  "pal_park_encounters": [],
  "form_descriptions": [],
  "flavor_text_entries": [
    {
      "flavor_text": "Terapagos protects itself using its power to transform energy into hard crystals. This Pokémon is the source of the Terastal phenomenon.",
      "language": {
        "name": "en",
        "url": "/api/v2/language/9/"
      },
      "version": {
        "name": "scarlet",
        "url": "/api/v2/version/40/"
      }
    },
    {
      "flavor_text": "It’s thought that this Pokémon lived in ancient Paldea until it got caught in seismic shifts and went extinct.",
      "language": {
        "name": "en",
        "url": "/api/v2/language/9/"
      },
      "version": {
        "name": "violet",
        "url": "/api/v2/version/41/"
      }
    }
  ],
  "genera": [
    {
      "genus": "テラスタルポケモン",
      "language": {
        "name": "ja-hrkt",
        "url": "/api/v2/language/1/"
      }
    },
    {
      "genus": "테라스탈포켓몬",
      "language": {
        "name": "ko",
        "url": "/api/v2/language/3/"
      }
    },
    {
      "genus": "Téracristal",
      "language": {
        "name": "fr",
        "url": "/api/v2/language/5/"
      }
    },
    {
      "genus": "Tera Pokémon",
      "language": {
        "name": "en",
        "url": "/api/v2/language/9/"
      }
    },
    {
      "genus": "テラスタルポケモン",
      "language": {
        "name": "ja",
        "url": "/api/v2/language/11/"
      }
    }
  ],
  "varieties": [
    {
      "is_default": true,
      "pokemon": {
        "name": "terapagos",
        "url": "/api/v2/pokemon/1024/"
      }
    },
    {
      "is_default": false,
      "pokemon": {
        "name": "terapagos-terastal",
        "url": "/api/v2/pokemon/10276/"
      }
    },
    {
      "is_default": false,
      "pokemon": {
        "name": "terapagos-stellar",
        "url": "/api/v2/pokemon/10277/"
      }
    }
  ]
}