{
  "id": 1007,
  "name": "koraidon",
  "order": 998,
  "gender_rate": -1,
  "capture_rate": 3,
  "base_happiness": 0,
  "is_baby": false,
  "is_legendary": true,
  "is_mythical": false,
  "hatch_counter": 50,
  "has_gender_differences": false,
  "forms_switchable": false,
  "growth_rate": {
    "name": "slow",
    "url": "/api/v2/growth-rate/1/"
  },
  "pokedex_numbers": [
    {
      "entry_number": 1007,
      "pokedex": {
        "name": "national",
        "url": "/api/v2/pokedex/1/"
      }
    },
    {
      "entry_number": 399,
      "pokedex": {
        "name": "paldea",
        "url": "/api/v2/pokedex/31/"
      }
    }
  ],
  "egg_groups": [
    {
      "name": "no-eggs",
      "url": "/api/v2/egg-group/15/"
    }
  ],
  "color": {
    "name": "red",
    "url": "/api/v2/pokemon-color/8/"
  },
  "shape": {
    "name": "upright",
    "url": "/api/v2/pokemon-shape/6/"
  },
  "evolves_from_species": null,
  "evolution_chain": {
    "url": "/api/v2/evolution-chain/535/"
  },
  "habitat": null,
  "generation": {
    "name": "generation-ix",
    "url": "/api/v2/generation/9/"
  },
  "names": [
    {
      "name": "コライドン",
      "language": {
        "name": "ja-hrkt",
        "url": "/api/v2/language/1/"
      }
    },
    {
      "name": "Koraidon",
      "language": {
        "name": "ja-roma",
        "url": "/api/v2/language/2/"
      }
    },
    {
      "name": "코라이돈",
      "language": {
        "name": "ko",
        "url": "/api/v2/language/3/"
      }
    },
    {
      "name": "故勒頓",
      "language": {
        "name": "zh-hant",
        "url": "/api/v2/language/4/"
      }
    },
    {
      "name": "Koraidon",
      "language": {
        "name": "fr",
        "url": "/api/v2/language/5/"
      }
    },
    {
      "name": "Koraidon",
      "language": {
        "name": "de",
        "url": "/api/v2/language/6/"
      }
    },
    {
      "name": "Koraidon",
      "language": {
        "name": "es",
        "url": "/api/v2/language/7/"
      }
    },
    {
      "name": "Koraidon",
      "language": {
        "name": "it",
        "url": "/api/v2/language/8/"
      }
    },
    {
      "name": "Koraidon",
      "language": {
        "name": "en",
        "url": "/api/v2/language/9/"
      }
    },
    {
      "name": "コライドン",
      "language": {
        "name": "ja",
        "url": "/api/v2/language/11/"
      }
    },
    {
      "name": "故勒顿",
      "language": {
        "name": "zh-hans",
        "url": "/api/v2/language/12/"
      }
    },
    {
      "name": "Koraidon",
      "language": {
        "name": "es-419",
        "url": "/api/v2/language/14/"
      }
    }
  ],
  "pal_park_encounters": [],
  "form_descriptions": [],
  "flavor_text_entries": [
    {
      "flavor_text": "This seems to be the Winged King mentioned in an old expedition journal. It was said to have split the land with its bare fists.",
      "language": {
        "name": "en",
        "url": "/api/v2/language/9/"
      },
      "version": {
        "name": "scarlet",
        "url": "/api/v2/version/40/"
      }
    },
    {
      "flavor_text": "This Pokémon resembles Cyclizar, but it is far burlier and more ferocious. Nothing is known about its ecology or other features.",
      "language": {
        "name": "en",
        "url": "/api/v2/language/9/"
      },
      "version": {
        "name": "violet",
        "url": "/api/v2/version/41/"
      }
    }
  ],
  "genera": [
    {
      "genus": "パラドックスポケモン",
      "language": {
        "name": "ja-hrkt",
        "url": "/api/v2/language/1/"
      }
    },
    {
      "genus": "패러독스포켓몬",
      "language": {
        "name": "ko",
        "url": "/api/v2/language/3/"
      }
    },
    {
      "genus": "悖謬寶可夢",
      "language": {
        "name": "zh-hant",
        "url": "/api/v2/language/4/"
      }
    },
    {
      "genus": "Paradoxe",
      "language": {
        "name": "fr",
        "url": "/api/v2/language/5/"
      }
    },
    {
      "genus": "Paradox",
      "language": {
        "name": "de",
        "url": "/api/v2/language/6/"
      }
    },
    {
      "genus": "Paradox Pokémon",
      "language": {
        "name": "en",
        "url": "/api/v2/language/9/"
      }
    },
    {
      "genus": "悖谬宝可梦",
      "language": {
        "name": "zh-hans",
        "url": "/api/v2/language/12/"
      }
    }
  ],
  "varieties": [
    {
      "is_default": true,
      "pokemon": {
        "name": "koraidon",
        "url": "/api/v2/pokemon/1007/"
      }
    },
    {
      "is_default": false,
      "pokemon": {
        "name": "koraidon-limited-build",
        "url": "/api/v2/pokemon/10264/"
      }
    },
    {
      "is_default": false,
      "pokemon": {
        "name": "koraidon-sprinting-build",
        "url": "/api/v2/pokemon/10265/"
      }
    },
    {
      "is_default": false,
      "pokemon": {
        "name": "koraidon-swimming-build",
        "url": "/api/v2/pokemon/10266/"
      }
    },
    {
      "is_default": false,
      "pokemon": {
        "name": "koraidon-gliding-build",
        "url": "/api/v2/pokemon/10267/"
      }
    }
  ]
}